Ether / IP / TCP 172.217.174.78:https > 10.250.3.246:51089 FA / Padding
Ether / IP / TCP 10.250.3.246:51089 > 172.217.174.78:https A
Ether / IPv6 / UDP fe80::9ea0:59d4:9c37:d1b1:51147 > ff02::1:3:llmnr / LLMNRQuery who has 'Shashanth.'
Ether / IP / UDP 10.250.1.248:51147 > 224.0.0.252:llmnr / LLMNRQuery who has 'Shashanth.'
Ether / IP / UDP / NBNSHeader / NBNSQueryRequest who has '\\DESKTOP-64K6FQN'
Ether / ARP who has 10.250.6.23 says 10.250.6.158 / Padding
Ether / IP / UDP / mDNS Qry b'MSI(28)._dosvc._tcp.local.'
Ether / IPv6 / UDP / mDNS Qry b'MSI(28)._dosvc._tcp.local.'
Ether / IP / UDP / mDNS Ans
Ether / IPv6 / UDP / mDNS Ans
Ether / IP / UDP / mDNS Qry b'MSI(29)._dosvc._tcp.local.'
Ether / IPv6 / UDP / mDNS Qry b'MSI(29)._dosvc._tcp.local.'
Ether / ARP who has 10.250.3.225 says 10.250.3.150 / Padding
Ether / IP / UDP / mDNS Ans b'Android-30.local.'
Ether / IPv6 / UDP / mDNS Ans b'Android-30.local.'
Ether / IP / UDP / mDNS Qry b'_microsoft_mcc._tcp.local.'
Ether / IP / UDP / mDNS Qry b'_microsoft_mcc._tcp.local.'
Ether / IPv6 / UDP / mDNS Qry b'_microsoft_mcc._tcp.local.'
Ether / IPv6 / UDP fe80::bf6e:92fb:66bb:468e:61727 > ff02::1:3:llmnr / LLMNRQuery who has 'UTKARSH_HP.'
Ether / IP / UDP 10.250.4.251:61727 > 224.0.0.252:llmnr / LLMNRQuery who has 'UTKARSH_HP.'
Ether / ARP who has 10.250.7.149 says 10.250.5.92 / Padding
Ether / ARP who has 10.250.1.1 says 10.250.10.186 / Padding
Ether / ARP who has 10.250.8.68 says 10.250.5.44 / Padding
Ether / IP / UDP / mDNS Qry b'AkhilChunduri._dosvc._tcp.local.'
Ether / IPv6 / UDP / mDNS Qry b'AkhilChunduri._dosvc._tcp.local.'
Ether / IP / UDP / mDNS Qry b'KARTHIK(1)._dosvc._tcp.local.'
Ether / IPv6 / UDP / mDNS Qry b'KARTHIK(1)._dosvc._tcp.local.'
Ether / IPv6 / UDP / mDNS Qry b'_microsoft_mcc._tcp.local.'
Ether / IP / UDP / mDNS Qry b'LAPTOP-77NB7B2I._dosvc._tcp.local.'
Ether / IPv6 / UDP / mDNS Qry b'LAPTOP-77NB7B2I._dosvc._tcp.local.'
Ether / ARP who has 10.250.7.169 says 10.250.7.220 / Padding
Ether / IPv6 / IPv6ExtHdrFragment / UDP / mDNS Ans
Ether / fe80::cde:f189:e912:b54c > ff02::fb (44) / IPv6ExtHdrFragment / Raw
Ether / IP / UDP / mDNS Ans
Ether / 10.250.5.147 > 224.0.0.251 udp frag:185 / Raw
Ether / IPv6 / UDP / mDNS Ans
Ether / IP / UDP / mDNS Ans
Ether / IP / UDP / mDNS Qry b'_dosvc._tcp.local.'
Ether / IPv6 / UDP / mDNS Qry b'_dosvc._tcp.local.'
Ether / ARP who has 10.250.6.206 says 10.250.2.17 / Padding
Ether / ARP who has 10.250.18.125 says 10.250.6.227 / Padding
Ether / IP / UDP / mDNS Qry b'LAPTOP-4B3Q0GP3._dosvc._tcp.local.'
Ether / ARP who has 10.250.5.233 says 10.250.6.148 / Padding
Ether / ARP who has 10.250.1.1 says 10.250.8.199 / Padding
Ether / IPv6 / UDP / mDNS Qry b'LAPTOP-4B3Q0GP3._dosvc._tcp.local.'
Ether / ARP who has 10.250.6.206 says 10.250.8.22 / Padding
Ether / IP / UDP / mDNS Qry b'MSI(30)._dosvc._tcp.local.'
Ether / IPv6 / UDP / mDNS Qry b'MSI(30)._dosvc._tcp.local.'
Ether / ARP who has 10.250.6.206 says 10.250.6.104 / Padding
Ether / ARP who has 10.250.8.23 says 10.250.2.241 / Padding
Ether / IP / TCP 104.211.241.114:http > 192.168.29.168:52765 A / Padding
Ether / IP / UDP 192.168.29.202:51481 > 192.168.29.255:5775 / Raw
Ether / IP / TCP 192.168.29.168:52764 > 104.211.241.114:http PA / Raw
Ether / IPv6 / TCP 2405:201:c00a:500b:607e:f741:bf2d:d6ed:52681 > 2a04:4e42:9::684:http FA
Ether / IP / TCP 104.211.241.114:http > 192.168.29.168:52764 A / Padding
Ether / IP / TCP 104.211.241.114:http > 192.168.29.168:52765 PA / Raw
Ether / IP / TCP 192.168.29.168:52765 > 104.211.241.114:http A
Ether / IP / TCP 104.211.241.114:http > 192.168.29.168:52765 A / Raw
Ether / IP / TCP 104.211.241.114:http > 192.168.29.168:52765 PA / Raw
Ether / IP / TCP 104.211.241.114:http > 192.168.29.168:52765 PA / Raw
Ether / IP / TCP 192.168.29.168:52765 > 104.211.241.114:http A
Ether / IP / TCP 104.211.241.114:http > 192.168.29.168:52765 PA / Raw
Ether / IP / TCP 192.168.29.168:52765 > 104.211.241.114:http A
Ether / IP / TCP 104.211.241.114:http > 192.168.29.168:52765 A / Raw
Ether / IP / TCP 104.211.241.114:http > 192.168.29.168:52765 PA / Raw
Ether / IP / TCP 104.211.241.114:http > 192.168.29.168:52765 A / Raw
Ether / IP / TCP 192.168.29.168:52765 > 104.211.241.114:http A
Ether / IP / TCP 104.211.241.114:http > 192.168.29.168:52765 A / Raw
Ether / IP / TCP 104.211.241.114:http > 192.168.29.168:52765 PA / Raw
Ether / IP / TCP 104.211.241.114:http > 192.168.29.168:52765 A / Raw
Ether / IP / TCP 104.211.241.114:http > 192.168.29.168:52765 A / Raw
Ether / IP / TCP 104.211.241.114:http > 192.168.29.168:52765 PA / Raw
Ether / IP / TCP 104.211.241.114:http > 192.168.29.168:52765 A / Raw
Ether / IP / TCP 104.211.241.114:http > 192.168.29.168:52765 A / Raw
Ether / IP / TCP 104.211.241.114:http > 192.168.29.168:52765 PA / Raw
Ether / IP / TCP 104.211.241.114:http > 192.168.29.168:52765 A / Raw
Ether / IP / TCP 104.211.241.114:http > 192.168.29.168:52765 A / Raw
Ether / IP / TCP 104.211.241.114:http > 192.168.29.168:52765 PA / Raw
Ether / IP / TCP 104.211.241.114:http > 192.168.29.168:52765 A / Raw
Ether / IP / TCP 104.211.241.114:http > 192.168.29.168:52765 A / Raw
Ether / IP / TCP 104.211.241.114:http > 192.168.29.168:52765 A / Raw
Ether / IP / TCP 104.211.241.114:http > 192.168.29.168:52765 PA / Raw
Ether / IP / TCP 104.211.241.114:http > 192.168.29.168:52765 A / Raw
Ether / IP / TCP 104.211.241.114:http > 192.168.29.168:52765 A / Raw
Ether / IP / TCP 192.168.29.168:52765 > 104.211.241.114:http A
Ether / IP / TCP 104.211.241.114:http > 192.168.29.168:52765 A / Raw
Ether / IP / TCP 104.211.241.114:http > 192.168.29.168:52765 PA / Raw
Ether / IP / TCP 104.211.241.114:http > 192.168.29.168:52765 A / Raw
Ether / IP / TCP 104.211.241.114:http > 192.168.29.168:52765 A / Raw
Ether / IP / TCP 104.211.241.114:http > 192.168.29.168:52765 A / Raw
Ether / IP / TCP 104.211.241.114:http > 192.168.29.168:52765 PA / Raw
Ether / IP / TCP 104.211.241.114:http > 192.168.29.168:52765 A / Raw
Ether / IP / TCP 104.211.241.114:http > 192.168.29.168:52765 A / Raw
Ether / IP / TCP 104.211.241.114:http > 192.168.29.168:52765 A / Raw
Ether / IP / TCP 104.211.241.114:http > 192.168.29.168:52765 PA / Raw
Ether / IP / TCP 192.168.29.168:52765 > 104.211.241.114:http A
Ether / IP / TCP 104.211.241.114:http > 192.168.29.168:52764 A / Raw
Ether / IP / TCP 192.168.29.168:52764 > 104.211.241.114:http A
Ether / IP / TCP 192.168.29.168:52765 > 104.211.241.114:http PA / Raw
Ether / IP / TCP 104.211.241.114:http > 192.168.29.168:52764 A / Raw
Ether / IP / UDP 192.168.29.202:53833 > 192.168.29.255:5775 / Raw
Ether / IP / UDP / DNS Qry b'live-jiol.cdn.hotstar.com.'
Ether / IP / UDP / DNS Qry b'live-jiol.cdn.hotstar.com.'
Ether / IP / UDP / DNS Qry b'live-jiol.cdn.hotstar.com.'
Ether / IPv6 / TCP 2405:201:c00a:500b:dd29:120f:119a:b35:55016 > 2405:200:160a:1916:76::10:https PA / Raw
Ether / IP / UDP / DNS Ans b'hotstar-vip-fa.cdn.jio.com.'
Ether / IP / UDP / DNS Ans b'hotstar-vip-fa.cdn.jio.com.'
Ether / IPv6 / TCP 2405:200:160a:1916:76::10:https > 2405:201:c00a:500b:dd29:120f:119a:b35:55016 A
Ether / IPv6 / TCP 2405:200:160a:1916:76::10:https > 2405:201:c00a:500b:dd29:120f:119a:b35:55016 A / Raw
Ether / IPv6 / TCP 2405:200:160a:1916:76::10:https > 2405:201:c00a:500b:dd29:120f:119a:b35:55016 PA / Raw
Ether / IPv6 / TCP 2405:201:c00a:500b:dd29:120f:119a:b35:55016 > 2405:200:160a:1916:76::10:https A
Ether / IP / UDP / DNS Ans b'hotstar-vip-fa.cdn.jio.com.'
Ether / IPv6 / TCP 2405:201:c00a:500b:dd29:120f:119a:b35:55016 > 2405:200:160a:1916:76::10:https PA / Raw
Ether / IPv6 / TCP 2405:200:160a:1916:76::10:https > 2405:201:c00a:500b:dd29:120f:119a:b35:55016 A
Ether / IPv6 / TCP 2405:200:160a:1916:76::10:https > 2405:201:c00a:500b:dd29:120f:119a:b35:55016 PA / Raw
Ether / IPv6 / TCP 2405:200:160a:1916:76::10:https > 2405:201:c00a:500b:dd29:120f:119a:b35:55016 A / Raw
Ether / IPv6 / TCP 2405:200:160a:1916:76::10:https > 2405:201:c00a:500b:dd29:120f:119a:b35:55016 A / Raw
Ether / IPv6 / TCP 2405:200:160a:1916:76::10:https > 2405:201:c00a:500b:dd29:120f:119a:b35:55016 A / Raw
Ether / IPv6 / TCP 2405:200:160a:1916:76::10:https > 2405:201:c00a:500b:dd29:120f:119a:b35:55016 A / Raw
Ether / IPv6 / TCP 2405:200:160a:1916:76::10:https > 2405:201:c00a:500b:dd29:120f:119a:b35:55016 A / Raw
Ether / IPv6 / TCP 2405:200:160a:1916:76::10:https > 2405:201:c00a:500b:dd29:120f:119a:b35:55016 A / Raw
Ether / IPv6 / TCP 2405:200:160a:1916:76::10:https > 2405:201:c00a:500b:dd29:120f:119a:b35:55016 A / Raw
Ether / IPv6 / TCP 2405:200:160a:1916:76::10:https > 2405:201:c00a:500b:dd29:120f:119a:b35:55016 A / Raw
Ether / IPv6 / TCP 2405:200:160a:1916:76::10:https > 2405:201:c00a:500b:dd29:120f:119a:b35:55016 A / Raw
Ether / IPv6 / TCP 2405:200:160a:1916:76::10:https > 2405:201:c00a:500b:dd29:120f:119a:b35:55016 A / Raw
Ether / IPv6 / TCP 2405:200:160a:1916:76::10:https > 2405:201:c00a:500b:dd29:120f:119a:b35:55016 A / Raw
Ether / IPv6 / TCP 2405:200:160a:1916:76::10:https > 2405:201:c00a:500b:dd29:120f:119a:b35:55016 A / Raw
Ether / IPv6 / TCP 2405:200:160a:1916:76::10:https > 2405:201:c00a:500b:dd29:120f:119a:b35:55016 A / Raw
Ether / IPv6 / TCP 2405:200:160a:1916:76::10:https > 2405:201:c00a:500b:dd29:120f:119a:b35:55016 A / Raw
Ether / IPv6 / TCP 2405:200:160a:1916:76::10:https > 2405:201:c00a:500b:dd29:120f:119a:b35:55016 A / Raw
Ether / IPv6 / TCP 2405:200:160a:1916:76::10:https > 2405:201:c00a:500b:dd29:120f:119a:b35:55016 PA / Raw
Ether / IPv6 / TCP 2405:200:160a:1916:76::10:https > 2405:201:c00a:500b:dd29:120f:119a:b35:55016 A / Raw
Ether / IPv6 / TCP 2405:201:c00a:500b:dd29:120f:119a:b35:55016 > 2405:200:160a:1916:76::10:https A
Ether / IPv6 / TCP 2405:200:160a:1916:76::10:https > 2405:201:c00a:500b:dd29:120f:119a:b35:55016 PA / Raw
Ether / IPv6 / TCP 2405:201:c00a:500b:dd29:120f:119a:b35:55016 > 2405:200:160a:1916:76::10:https A
Ether / IPv6 / TCP 2405:200:160a:1916:76::10:https > 2405:201:c00a:500b:dd29:120f:119a:b35:55016 PA / Raw
Ether / IPv6 / TCP 2405:201:c00a:500b:dd29:120f:119a:b35:55016 > 2405:200:160a:1916:76::10:https A
Ether / IPv6 / TCP 2405:200:160a:1916:76::10:https > 2405:201:c00a:500b:dd29:120f:119a:b35:55016 A / Raw
Ether / IPv6 / TCP 2405:200:160a:1916:76::10:https > 2405:201:c00a:500b:dd29:120f:119a:b35:55016 A / Raw
Ether / IPv6 / TCP 2405:200:160a:1916:76::10:https > 2405:201:c00a:500b:dd29:120f:119a:b35:55016 A / Raw
Ether / IPv6 / TCP 2405:200:160a:1916:76::10:https > 2405:201:c00a:500b:dd29:120f:119a:b35:55016 A / Raw
Ether / IPv6 / TCP 2405:200:160a:1916:76::10:https > 2405:201:c00a:500b:dd29:120f:119a:b35:55016 A / Raw
Ether / IPv6 / TCP 2405:200:160a:1916:76::10:https > 2405:201:c00a:500b:dd29:120f:119a:b35:55016 A / Raw
Ether / IPv6 / TCP 2405:200:160a:1916:76::10:https > 2405:201:c00a:500b:dd29:120f:119a:b35:55016 A / Raw
Ether / IPv6 / TCP 2405:200:160a:1916:76::10:https > 2405:201:c00a:500b:dd29:120f:119a:b35:55016 A / Raw
Ether / IPv6 / TCP 2405:200:160a:1916:76::10:https > 2405:201:c00a:500b:dd29:120f:119a:b35:55016 A / Raw
Ether / IPv6 / TCP 2405:200:160a:1916:76::10:https > 2405:201:c00a:500b:dd29:120f:119a:b35:55016 A / Raw
Ether / IPv6 / TCP 2405:200:160a:1916:76::10:https > 2405:201:c00a:500b:dd29:120f:119a:b35:55016 A / Raw
Ether / IPv6 / TCP 2405:200:160a:1916:76::10:https > 2405:201:c00a:500b:dd29:120f:119a:b35:55016 A / Raw
Ether / IPv6 / TCP 2405:200:160a:1916:76::10:https > 2405:201:c00a:500b:dd29:120f:119a:b35:55016 A / Raw
Ether / IP / TCP 54.185.217.227:https > 192.168.29.168:51411 A
Ether / IP / TCP 54.185.217.227:https > 192.168.29.168:51411 A / Raw
Ether / IP / TCP 54.185.217.227:https > 192.168.29.168:51411 PA / Raw
Ether / IP / TCP 192.168.29.168:51411 > 54.185.217.227:https A
Ether / IP / TCP 192.168.29.168:51411 > 54.185.217.227:https PA / Raw
Ether / IP / TCP 192.168.29.168:51411 > 54.185.217.227:https PA / Raw
Ether / IP / TCP 192.168.29.168:51411 > 54.185.217.227:https PA / Raw
Ether / IP / TCP 192.168.29.168:51411 > 54.185.217.227:https A / Raw
Ether / IP / TCP 192.168.29.168:51411 > 54.185.217.227:https A / Raw
Ether / IP / TCP 192.168.29.168:51411 > 54.185.217.227:https PA / Raw
Ether / IP / TCP 192.168.29.168:51403 > 140.82.114.22:https A
Ether / IP / TCP 52.182.143.211:https > 192.168.29.168:51407 A / Raw
Ether / IP / TCP 192.168.29.168:51407 > 52.182.143.211:https A
Ether / IP / TCP 52.182.143.211:https > 192.168.29.168:51407 PA / Raw
Ether / IP / TCP 192.168.29.168:51407 > 52.182.143.211:https A
Ether / IP / TCP 192.168.29.168:51407 > 52.182.143.211:https PA / Raw
Ether / IP / TCP 192.168.29.168:51407 > 52.182.143.211:https PA / Raw
Ether / IP / TCP 192.168.29.168:51399 > 192.168.29.1:domain S
Ether / IP / TCP 192.168.29.168:51398 > 192.168.29.1:domain S
Ether / IP / TCP 192.168.29.168:51397 > 192.168.29.1:domain S
Ether / IP / TCP 54.185.217.227:https > 192.168.29.168:51412 A
Ether / IP / TCP 54.185.217.227:https > 192.168.29.168:51412 A / Raw
Ether / IP / TCP 54.185.217.227:https > 192.168.29.168:51412 PA / Raw
Ether / IP / TCP 192.168.29.168:51412 > 54.185.217.227:https A
Ether / IP / TCP 192.168.29.168:51412 > 54.185.217.227:https PA / Raw
Ether / IPv6 / TCP 2405:201:c00a:500b:6c94:2f24:ba89:c0a3:51408 > 2405:201:c00a:500b::c0a8:1d01:domain S
Ether / IPv6 / TCP 2405:201:c00a:500b:6c94:2f24:ba89:c0a3:51410 > 2405:201:c00a:500b::c0a8:1d01:domain S
Ether / IPv6 / TCP 2405:201:c00a:500b:6c94:2f24:ba89:c0a3:51409 > 2405:201:c00a:500b::c0a8:1d01:domain S
Ether / IP / TCP 54.185.217.227:https > 192.168.29.168:51411 A
Ether / IP / TCP 54.185.217.227:https > 192.168.29.168:51411 A
Ether / IP / TCP 54.185.217.227:https > 192.168.29.168:51411 PA / Raw
Ether / IP / TCP 54.185.217.227:https > 192.168.29.168:51411 PA / Raw
Ether / IP / TCP 192.168.29.168:51411 > 54.185.217.227:https A
Ether / IP / TCP 192.168.29.168:51411 > 54.185.217.227:https PA / Raw
Ether / IP / TCP 54.185.217.227:https > 192.168.29.168:51411 PA / Raw
Ether / IP / TCP 54.185.217.227:https > 192.168.29.168:51411 PA / Raw
Ether / IP / TCP 192.168.29.168:51411 > 54.185.217.227:https A
Ether / IP / TCP 52.182.143.211:https > 192.168.29.168:51407 PA / Raw
Ether / IP / TCP 192.168.29.168:51407 > 52.182.143.211:https A
Ether / IP / TCP 52.182.143.211:https > 192.168.29.168:51407 A
Ether / IP / TCP 54.185.217.227:https > 192.168.29.168:51412 PA / Raw
Ether / IP / TCP 54.185.217.227:https > 192.168.29.168:51412 PA / Raw
Ether / IP / TCP 54.185.217.227:https > 192.168.29.168:51411 A
Ether / IP / TCP 192.168.29.168:51412 > 54.185.217.227:https A
Ether / IPv6 / UDP / DNS Qry b'forgooditjxygd.dataplane.rudderstack.com.'
Ether / IPv6 / UDP / DNS Qry b'telemetry.individual.githubcopilot.com.'
Ether / IPv6 / UDP / DNS Ans
Ether / IPv6 / UDP / DNS Ans b'copilot-telemetry-service.githubusercontent.com.'
Ether / IP / TCP 192.168.29.168:51413 > 34.194.111.92:https S
Ether / IP / TCP 192.168.29.168:51414 > 140.82.113.21:https S
Ether / IP / TCP 13.107.6.175:https > 192.168.29.168:50843 A
Ether / ARP who has 192.168.29.180 says 192.168.29.1
Ether / IP / TCP 20.189.173.16:https > 192.168.29.168:50940 A / Raw
Ether / IP / TCP 20.189.173.16:https > 192.168.29.168:50940 PA / Raw
Ether / IPv6 / TCP 2620:1ec:50::12:https > 2405:201:c00a:500b:94:80f5:4d97:97ec:50400 PA / Raw
Ether / IP / TCP 192.168.29.168:50940 > 20.189.173.16:https A
Ether / IP / TCP 192.168.29.168:50940 > 20.189.173.16:https A / Raw
Ether / IP / TCP 192.168.29.168:50940 > 20.189.173.16:https PA / Raw
Ether / IPv6 / TCP 2405:201:c00a:500b:94:80f5:4d97:97ec:50400 > 2620:1ec:50::12:https PA / Raw
Ether / IPv6 / TCP 2405:201:c00a:500b:94:80f5:4d97:97ec:50400 > 2620:1ec:50::12:https PA / Raw
Ether / IPv6 / TCP 2620:1ec:50::12:https > 2405:201:c00a:500b:94:80f5:4d97:97ec:50400 A
Ether / 192.168.29.168 > 224.0.0.22 2 / Raw
Ether / IP / TCP 20.189.173.16:https > 192.168.29.168:50940 A
Ether / IP / TCP 20.189.173.16:https > 192.168.29.168:50940 PA / Raw
Ether / IP / TCP 192.168.29.168:50940 > 20.189.173.16:https A
Ether / IPv6 / TCP 2405:201:c00a:500b:94:80f5:4d97:97ec:50840 > 2405:200:1608:1731::b854:e818:https A / Raw
Ether / IPv6 / TCP 2405:200:1608:1731::b854:e818:https > 2405:201:c00a:500b:94:80f5:4d97:97ec:50840 A
Ether / IP / TCP 20.189.173.16:https > 192.168.29.168:50940 FPA / Raw
Ether / IP / TCP 192.168.29.168:50940 > 20.189.173.16:https A
Ether / IP / TCP 192.168.29.168:50940 > 20.189.173.16:https PA / Raw
Ether / IP / TCP 192.168.29.168:50940 > 20.189.173.16:https FA
Ether / IPv6 / TCP 2405:201:c00a:500b:94:80f5:4d97:97ec:50839 > 2405:200:1608:1731::b854:e818:https A / Raw
Ether / ARP who has 192.168.29.180 says 192.168.29.1
Ether / IP / UDP 192.168.29.202:46312 > 192.168.29.255:5775 / Raw
Ether / IPv6 / TCP 2405:200:1608:1731::b854:e818:https > 2405:201:c00a:500b:94:80f5:4d97:97ec:50839 A
Ether / IPv6 / TCP 2405:201:c00a:500b:94:80f5:4d97:97ec:50669 > 2620:1ec:50::12:https A / Raw
Ether / IPv6 / TCP 2620:1ec:50::12:https > 2405:201:c00a:500b:94:80f5:4d97:97ec:50669 A
Ether / IP / TCP 20.189.173.16:https > 192.168.29.168:50940 A
Ether / IP / TCP 192.168.29.168:50834 > 52.168.112.67:https PA / Raw
Ether / IP / TCP 192.168.29.168:50834 > 52.168.112.67:https A / Raw
Ether / IP / TCP 192.168.29.168:50834 > 52.168.112.67:https A / Raw
Ether / IP / TCP 192.168.29.168:50834 > 52.168.112.67:https A / Raw
Ether / IP / TCP 192.168.29.168:50834 > 52.168.112.67:https A / Raw
Ether / IP / TCP 192.168.29.168:50834 > 52.168.112.67:https A / Raw
Ether / IP / TCP 192.168.29.168:50834 > 52.168.112.67:https A / Raw
Ether / IP / TCP 192.168.29.168:50834 > 52.168.112.67:https A / Raw
Ether / IP / TCP 192.168.29.168:50834 > 52.168.112.67:https A / Raw
Ether / IP / TCP 192.168.29.168:50834 > 52.168.112.67:https A / Raw
Ether / IP / TCP 192.168.29.168:50834 > 52.168.112.67:https PA / Raw
Ether / ARP who has 192.168.29.180 says 192.168.29.1
Ether / IP / TCP 52.168.112.67:https > 192.168.29.168:50834 A / Padding
Ether / IP / TCP 52.168.112.67:https > 192.168.29.168:50834 A / Padding
Ether / IP / TCP 52.168.112.67:https > 192.168.29.168:50834 A / Padding
Ether / IP / TCP 52.168.112.67:https > 192.168.29.168:50834 PA / Raw
Ether / IP / TCP 192.168.29.168:50834 > 52.168.112.67:https PA / Raw
Ether / IP / TCP 52.168.112.67:https > 192.168.29.168:50834 A / Padding
Ether / ARP who has 192.168.29.180 says 192.168.29.1
Ether / IP / UDP 192.168.29.202:46312 > 192.168.29.255:5775 / Raw
Ether / IP / TCP 192.168.29.168:50834 > 52.168.112.67:https PA / Raw
Ether / IP / TCP 192.168.29.168:50834 > 52.168.112.67:https A / Raw
